j/jonesjuice.htm,Jones Juice may cause you to fail drug tests,      An email claiming to be from a "Lt. Col. Hayes" warns not to drink Jones Juice a new soft drink that contains hemp seed oil.  Because hemp contains the active ingredient of marijuana anyone drinking Jones Juice could test positive in a urine test for drugs.  The email says it is illegal for military members to drink the stuff so they should avoid buying it.  The email is accompanied by a picture warning as well..  An email claiming to be from a "Lt. Col. Hayes" warns not to drink Jones Juice a new soft drink that contains hemp seed oil.  Because hemp contains the active ingredient of marijuana anyone drinking Jones Juice could test positive in a urine test for drugs.  The email says it is illegal for military members to drink the stuff so they should avoid buying it.  The email is accompanied by a picture warning as well. ,0
j/joshuaday.htm,NASA computers found the "missing day" of the Bible story about Joshua,Anemail says that NASA (The U.S. National Aeronautics and Space Administration) has stumbled across some computer generated evidence thatthe Bible is true.  A man named Harold Hill a NASA consultant andpresident of the Curtis engine company describes how NASA computers werelooking back in time when they issued an alert that something was wrong.  There seemed to be a day missing from the calculations.  The scientistspuzzled over this a long time until someone in their midst reflected that in theBible there's a story about the day the sun stood still for the Hebrew leaderJoshua.  This solves the puzzle almost.  According to the computernot an entire day was lost but 23 hours and 20 minutes.  Now there's a newproblem.  What about the other 40 minutes?  That's when the same employee remembers that there is anotherstory in the Bible about a day when the sun moved backwards 10 degrees whichaccording to the employee is an arc of 40 minutes...so the entire question ofthe missing day is solved!   ,0
j/joy-bugs.htm,Lemon Fresh Joy detergent kills mosquitoes,The writer of the eRumor says that putting a couple of drops of Lemon Fresh Joy dish detergent in water on a white dinner plate will control mosquitoes.  The email claims the tip was posted on a gardening forum.  It claims that the bugs are attracted to the mixture drink it and immediately die. ,0
j/judge.htm,The Judge and the Shoe Bomber,The message includes the comments of U.S. District Court Judge William Young and his January 2003 sentencing of convicted "shoe bomber" Richard Reid.  In his comments the judge explains to Reid why the stiff sentence was righteous and just. ,1
j/julie-andrews-aging.htm,Julie Andrews singing about aging,The eRumor describes a 69th birthday event on October 1 at which singer/actress Julie Andrews sang a humorous rendition of My Favorite Things a song she helped make famous in the film The Sound of Music.  The eRumor says the event was at Radio City Music Hall in New York and was a benefit concert for AARP. ,0
j/july4.htm,Don't drink certain soft drink brands after July 3,There are several versions circulating but they all involve a person in a check-out line at a store behind a person who looks or is dressed Middle Eastern.  The Middle Easterner is a few cents short of being able to pay for his or her purchase and the next person in line offers to make up the difference.  Later the Middle Easterner comments on how nice that was and how he or she hasn't been treated right ever since September 11.  In appreciation the Middle Easterner offers what seems to be insider terrorist information...not to drink a certain brand of soft drink after July 3.  The implication is that the drink is poisoned.  Some of the eRumors say to avoid Coke.  Some say to avoid Pepsi. ,0
j/jumamah-capitol-steps.htm,Muslims Are Meeting to Pray on the Capitol Steps on September 25 2009,A forwarded eRumor warning that Muslims will be gathering at the steps in front of the the US Capitol Building in Washington DC on September 25 2009.   The email goes on to say that 50000 are expected to attend to pray for 15 hours and that the organizers got their inspiration from President Obama's speech in Cairo Egypt where he said the United States was no longer a Christian Nation.  The eRumor also asks “Do you think Christians would be allowed to do an event like this?”  ,1
j/jumbo-military.htm,Giant military jet stranded over roadway,Pictures of a giant C-5 Galaxy sitting on an overpass.  The story says it got stuck on the runway at the Norfolk Naval Station because it could not turn around.   ,1
j/jury_duty_scam.htm,The Phone Call you Got About Jury Duty May be From Crooks,The eRumor warns that you could get a phone call from someone claiming that you failed to show up for jury duty and that a warrant has been issued for your arrest.The caller then wants to confirm your personal information such as Social Security number and other financial data.The email says they are actually crooks who are trying to get enough information to commit identity theft. ,1
j/justinmallory.htm,Forward an email for Justin Mallory and he'll get contributions for treating his epilepsy,Justin Mallory is 12 years old.  He has epilepsy and has a year to live.  McDonalds and Pizza Hut have offered to contribute one dollar for his medical care for every email that is forwarded to others around the Internet.  ,0
j/juval-aviv.htm,The Controversy of Juval Aviv,A forwarded email about a former Israeli counter terrorism intelligence officer named Juval Aviv.  The email says that he was one of the Israeli Agents who took part in the hunting and termination of the terrorist who held Israeli athletes hostage and killed them during the Munich Olympic Games.  The email also says that Aviv has predicted a future terrorist attack in the United States and at a security conference gave helpful tips on how to prepare for such an event.   The email also say that he warned the Bush Administration of the possibility of terrorists using planes to target tall buildings one month prior to the attack of the World Trade Center and Pentagon on September 11 2001. ,1
j/kareem-abdul-jabbar.htm,The Story of Kareem Abdul-Jabbar and the Rabbi,This is a forwarded story about  Lakers basketball player Kareem Abdul-Jabbar and a Rabbi named Yisrael Mir Lau. It says that Jabbar is flying to Israel on the dying wish of his father to meet the man he rescued from a Nazi concentration camp in World War II.  ,1
k/Charles-Krauthammer.htm,Dr. Charles Krauthammer comments about President Obama,A forwarded email with comments by journalist Pulitzer Prize winner and Fox News contributor Charles Krauthammer about President Obama.  ,0
k/k7bomber.htm,Bomber Designed in 1933 by Russia had a wingspan greater than a US B-52,A forwarded email with photos of a massive Bomber built by Russians in the 1930's.  ,1
k/Kagan-Payback.htm,Obama Nominated Elena Kagan to the Supreme Court as a Payback,Various emails circulating the Internet alleging that President Obama nominated Elena Kagan to the Supreme Court as a pay back for denying requests for cases questioning the Presidents citizenship when she was a clerk for the court.  ,0
k/kalat.htm,Iraqi statue honoring American soldiers,A picture of a statue of an American soldier kneeling in honor of a fallen comrade and being comforted by an Iraqi child.  The accompanying text says the statue is in Iraq and was made by the same Iraqi artist who did some of the statues of Saddam Hussein and were constructed from melted Saddam statutes.  ,1
k/kalin.htm,Forward an email for medical care for Kalin, This email says it is from Katie Relek of Alabama.  It says her son Kalin is 7 years old and was struck by a car in front of her home.  She says he's alive but in serious condition has internal bleeding and needs surgery.  She doesn't have health insurance but has arranged with a company called "BCC Inc." that for every email about Kalin that is forwarded by the readers five cents will be donated toward his medical costs.  ,0
k/kansasprayer.htm,The preacher's prayer that stirred the Kansas legislature, The email says that a session of the Kansas State Senate was opened in prayer by a Pastor Joe Wright.  His prayer was a sizzling one and prompted controversy.  The story says that several members of the Senate got up and walked out and that Paul Harvey aired the text of the prayer and it prompted the largest response he's ever had.  ,1
k/kathy-griffin.htm,Comedian Kathy Griffin's "Suck it Jesus" Comment,A forwarded email complains about an appearance by comedian Kathy Griffin on the Emmy Awards show.  In accepting an award she allegedly said that no one had less to do with her award than Jesus then said "Suck it Jesus.  This is my God now." ,1
k/kati-moss.htm,Prayer for Kati Moss in Georgia,The email says that 14-year-old Kati Moss of Rome Georgia is battling cancer.  You are encouraged to call her pager and punch in your zip code as evidence that you are praying for her and to tell her where you're from. ,1
k/katie-fitch.htm,Pray for Katie Fitch,A prayer request for 3-year old Katie Fitch said to be suffering from a rare form of liver cancer. ,1
k/kaufman.htm,Actor Andy Kaufman returns from the dead?,Stories and emails are circulating on the Internet that claim that actor Andy Kaufman who died in 1984 of lung cancer is alive. They refer to a website at andykaufmanreturns.blogspot.com that has allegedly been set up by Kaufman to announce his return. andykaufmanreturns.blogspot.com ,0
k/kay-arthur-prophecy.htm,Kay Arthur's Prophecy of Famine for USA,Email supposedly written by a person named Beth Moore about her hearing a prophecy given by fellow Christian author and teacher Kay Arthur at a woman's conference stating that a "literal famine is coming to America. Physical not spiritual.”   ,0
k/keeshan.htm,Actor Lee Marvin gives tribute to fellow Marine Bob Keeshan,The message says that Lee Marvin appeared on the Tonight Show in the 70's when host Johnny Carson brought up Marvin's record in the Marines.  Carson said people may not have known that Marvin fought in Iwo Jima one of the best known battles of World War II and was awarded the Navy Cross.  Marvin then tells a story of heroism in battle about the bravest man he ever knew who was also awarded the Navy Cross...Bob Keeshan who later became best known as Captain Kangaroo.   ,0
k/keillor.htm,Radio Personality and Author Garrison Keillor Wants To Take VotingPrivileges Away from Born Again Christians,The eRumor quotes NPR radio host Garrison Keillor as saying that he as a Democrat feels that born-again Christians should not be allowed to vote and that he is the national chairman of a campaign to pass a constitutional amendment to take the right to vote away from them. ,0
k/kelsey.htm,Kelsey Brooke Jones a missing little girl,Themost common email about Kelsey Brooke Jones says it's from her mother and pleadsfor help in finding her.  The email says she disappeared from SouthernMinnesota and urges contacting the police.  The email also refers to peopleto have the mother's number indicating that perhaps it was sent to closefriends or family.  ,0
k/kennedy-rumsfeld.htm,Rumsfeld shutting down Ted Kennedy,An alleged exchange between U.S. Defense Secretary Donald Rumsfeld and Senator Ted Kennedy during Rumsfeld testimony before congress. Rumsfeld is quoted as having shut down Kennedy by making reference to a 1969 incident in which a woman died in a car driven off a bridge by the Senator. ,0
k/kerry-fonda.htm,John Kerry and Jane Fonda speaking at anti-war rally,A picture of a younger John Kerry and controversial actress/anti-war activist Jane Fonda participating together at a rally during the Vietnam era. ,0
k/kerry-pa.htm,John Kerry forcibly took over a Pennsylvania neighborhood for a campaignappearance,The eRumor says that John Kerry came to Canonsburg Pennsylvania on Labor Day 2004 and commandeered a neighborhood for a "front porch" meeting. The writer claims that none of the residents of the neighborhood was allowed to attend that the Kerry campaign brought 90 people from out of town that Kerry claimed "imminent domain" to clear the street for a full block and that residents were required to remove Bush-Cheney signs from their front yards. ,0
k/kerry-swiftboats.htm,Accusations against John Kerry from Former Navy Swift Boat crewmen from the Vietnam War,There is a series of forwarded emails about Democratic Presidential Candidate John Kerry and the accusations of an organization of swift boat crews from the Vietnam era. ,1
k/kerry.htm,John Kerry's anti-war past,A collection of various eRumors about John Kerry during the 2004 presidential season. ,1
k/kerrybible.htm,John Kerry gets mixed up quoting his favorite Bible verse,The eRumor says that John Kerry tried to demonstrate his commitment to faith during a speech by quoting his favorite Bible verse. He meant to refer to John 3:16 but referenced John 16:3 instead with humorous results. ,0
k/kerryviet.htm,John Kerry endorsed by the Communists,The eRumor says that the Communist Party of the U.S. has endorsed John Kerry. It quotes a letter from a Communist Party official in Georgia who said the party supports John Kerry and regards the defeat of George Bush to be the single most important issue in November. It also says that one of Kerry's campaign themes "Let America Be America Again" is borrowed from a Communist poet and that John Kerry is in "The Hanoi Hall of Fame" in Vietnam.  ,0
k/ketchup-hiv.htm,HIV Blood in a Ketchup Dispenser at a Fast Food Restaurant,The forwarded email warns that someone who is believed to be HIV-positive was found putting blood into a ketchup dispenser at a fast-food restaurant.  It warns to only use sealed packets of ketchup. ,0
k/kevincarter.htm,Pulitzer Prize Winning Photographer Kills Himself and Leaves Suicide NoteAbout World Hunger,The eRumor includes a dramatic photograph of a starving child being watched by a vulture. The email says that the picture was taken in Sudan 1994 by Kevin Carter who won a Pulitzer prize for it. The eRumor says he committed suicide three months later and left a note about world hunger. ,1
k/keycards.htm,Hotel key cards being used for identity theft?,A warning that key cards issued to hotel or motel guests as room keys are being used for identity theft. The story says that Southern California Law Enforcement professionals discovered that some hotel room keys include the guest's name credit card information and other data that could be used for identity theft. ,0
k/kfcgeneticchickens.htm,KFC is raising freak genetically engineered chickens, Thisclaims that KFC (formerly known as Kentucky Fried Chicken) is trying to increase profits by developing geneticallyengineered chickens that have more meat are cheaper to raise and faster toprocess.  They are variously described as having no heads no beaks nolegs and no feathers.  That's why they changed their name to KFC. ,0
k/kidneys.htm,The tourist who woke up with no kidneys,There are various versions (such as the one below) but they all talk about a traveling businessman or a tourist who becomes involved with someone from the area where he is visiting.  The next thing he remembers he's awakening in a bathtub full of ice.  He either reads a note that informs him that his kidneys have been harvested for an organ transplant or he picks up the phone and reaches either the hotel operator or the police.  Through the phone call he learns that his kidneys have been removed by medical crooks and he discovers the stitched wounds where the surgery took place.  Emergency personnel arrive on the scene to give him first-aid and take him to a hospital where he is described as being on a transplant waiting list.  ,0
k/kidrock.htm,Rock-rapper Kid Rock is country Singer Hank Williams Jr.'s son,The rumor is that Kid Rock is the son of country music legend Hank Williams Jr. ,0
k/kiesling.htm,Resignation letter of John Brady Kiesling,The email says it's the letter of resignation of career diplomat John Brady Kiesling from U.S. State Department. ,1
k/kinsley.htm,Reagan diary entry about George W. Bush,An alleged quote from the published diaries of U.S. President Ronald Reagan calling George W. Bush a "n'er-do-well" who "hangs around here all the time looking shiftless" and at the age of 40 "has never had a real job."  The diary entry says "Maybe I'll call Kinsley over at the New Republic and see if they'll hire him as a contributing editor or something." ,0
k/kittenger-free-fall.htm,Man Jumped From an Altitude of 102800 Feet Back to Earth,This is a forwarded email with the story of  U.S. Air Force Captain Joe Kittenger's amazing free fall jump from close to 20 miles above the Earth.   The email alleges that Kittenger floated to outer space in a specially equipped balloon and jumped from a height of 102800 feet with nothing more than a special pressurized suit and a parachute.  ,1
k/kkk-obama.htm,The Ku Klux Klan has endorsed Barack Obama for president,The forwarded email is what appears to be a news story that claims that the White Supremacist group the Ku Klux Klan has endorsed the candidacy of African American Senator Barack Obama in the 2008 race for president of the United States.  ,0
k/klingermanvirus.htm,Klingerman Virus is coming to people's homes in blue envelopes, This email says a malady called THE KLINGERMAN VIRUS is being randomly spread through the U.S. Mail and that there have been deaths as a result.  Some versions say the warning has been issued by the Schwab company.  The virus is in a small sponge sealed in plastic and sent in a large blue envelope that says "A gift for you from the Klingerman Foundation."  It is described as a virus never previously known and that the Centers For Disease Control and local authorities in Florida are working on it.  It claims that 23 people have been infected and that seven of them have died.  ,0
k/komen.htm,Pink Ribbon at Yahoo, T his is a short email that simply encourages you to go to health.yahoo.com and click the pink ribbon to donate to breast cancer. ,1
k/kopiluwak.htm,Expensive coffee from monkey digestive systems, Kopi Luwak is a rare and gourmet coffee from Indonesia that is made from beans passed through the digestive system of monkeys. ,1
k/koran-war.htm,Koran 9:11 refers to the war in iraq?,A verse in the Koran which happens to correspond to the date of the Attack on America predicts that "the wrath of the Eagle" would be felt throughout the lands of Allah. ,0
k/Korea-Got-Talent.htm,The Amazing Story and Performance of a Contestant in a Korean Talent Program,This is a forwarded YouTube video link about a young South Korean man named Sung-bong Choi who auditioned for the popular Korea's Got Talent television show.  When asked about his family background he told judges that he ran away from an orphanage after being beaten and grew up living in the streets.  He then proceeded to surprise everyone with his operatic voice.  ,1
k/kosherslaughter.htm,Kosher slaughter of animals banned in Holland,What appears to be an article says that the government of Holland has banned Kosher slaughter..  According to the article the government considered the kosher slaughter of cows "cruelty" to animals.  A rabbi likened the action to the banning of kosher slaughter in Germany by Hitler as one of the first acts against the Jews. ,0
k/krystava.htm,Krystava Patients Schmidt a missing girl, An email from the mother Christine Schmidt says she lives in Mounds View Minnesota and that her 20-month old girl Krystava Patients has been abducted.  She says she was last seen with a "Becky Lynn Deamond" in 1997 who took the girl as well as Christine grandmother's car. ,1
k/kurtwarner.htm,The love story of Kurt Warner and his wife Brenda, Kurtis a stock boy meets and falls instantly in love with Brenda a cashier at the supermarket where they both work.  He asks her out and she resists saying she's got 2 kids and no money for a babysitter.  Kurtis offers to pay for the sitter so she accepts.  Kurtis meets the children one of whom is a boy in a wheelchair who has Down Syndrome.  At the last minute the babysitter is not available and Kurtis offers to take the whole family out for the evening.  He's a hit with the kids and they are a hit with him and Brenda decides Kurtis is the man for her.  A year later they are married and Kurtis the stock boy is actually Kurt Warner the quarterback for the St. Louis Rams. ,1
k/kyle.htm,The Story of Kyle saved from suicide by a friend,The story of a high school student named Kyle a kid who was befriended by another student who first viewed him as a nerd.  They become good friends.  At graduation Kyle is valedictorian and reveals that on the day that his pal befriended him he was contemplating suicide.  The moral of the story is to never underestimate the power of your actions because one small gesture can change a person's life. ,0
k/ted-kennedy-legacy.htm,An Email about called "The Last of the Kennedy Dynasty",A forwarded email about Senator Edward Kennedy called "The Last of the Kennedy Dynasty" criticizing the main stream media for omitting certain facts of his past.  The email lists various items in the history of Ted Kennedy. ,1
l/help-lopez.htm,Help The Lopez Family,A forwarded email that tells a story of a series of tragic events in the life of a family in Melrose Park Illinois and asks for donations. ,1
l/kathleen-lyday.htm,School Teacher's Letter to Obama,A forwarded email containing a letter to President Obama claiming to be from a school teacher named Ms Kathleen Lyday.   The letter is critical of the things that the President said and did while on an overseas trip during March and April 2009.   ,0
l/kit-lange.htm,Air Force Veteran Wrote Predictions For The Obama Presidency,A forwarded email of an article written by Air Force Veteran Kit Lange containing her predictions for the Obama Administration.  They  include an increase of  web sites and Spam with offers government grants and an rise of terrorist activity from Iran.  She also predicts that Obama will appoint Supreme Court Justices with liberal agendas who could introduce Sharia law into the US legal system.   Among additional predictions are a decrease of US support of Israel and the chipping away of Constitutional rights. ,1
l/laminin.htm,Laminin a protein important to the body is in the shape of a cross,The eRumor talks of a substance called "laminin" that is described as part of a family of proteins that "hold us together."  Then there is a picture of laminin---which looks like a cross. ,1
l/lamm.htm,"American Suicide" a speech by Former Colorado Governor RichardLamm,A speech by former Colorado Governor Richard Lamm on how multiculturalism can affect America.   ,1
l/lanisha.htm,Help cancer victim Lanisha Jackson,Eight-year-old LaNisha Jackson has lung cancer from second-hand smoke as well as a tumor from repeated beatings.  If you forward the email about her the Make-A-Wish Foundation will donate 7 cents per email for her medical care. ,0
l/LASD-Warning-Carseat-Eggs.htm,L.A. Sheriff Department Warns Of Gang Tactics Used To Get Drivers To Pull Over,This is a forward email allegedly from the Los Angeles County Sheriff's Department that warns of gangs using fake babies in car seats along the road to lure motorists to pull over and stop to investigate.   The email also warns not to use windshield wipers to clean off eggs that are thrown at cars. It says that this would cloud up visibility and force drivers to pull over to the side of the road when water from the wiper tank is mixed with the eggs by your windshield wipers.  ,0
l/last-flight.htm,Diary of a Marine's final flight home,A first-hand narrative of being on an airline flight carrying the body of a fallen Marine home to Southern California. ,1
l/lastpatrol.htm,Prayer Request for David Kristynik in Iraq,A prayer request from Christina Kristynik the wife of a U.S. soldier named David Kristynik.  It says that he's due back soon in the U.S. but that he called to say that his unit was going on a dangerous mission on foot in Baghdad to go door to door looking for snipers.   The men have been told that it is very likely that most of them will not return. ,1
l/lastpic.htm,The last picture from atop the World Trade Center,This is a photo of a young tourist at the top of the World Trade Center...with a jetliner closing-in in the background.  The eRumor claims that the camera that took the picture was found in the rubble and the film was developed revealing this shot just seconds before the tower was struck by the plane. ,0
l/lastsupper.htm,Leonardo used the same man for Jesus and Judas in the last supper painting, This email claims that Leonardo Da Vinci spent seven years painting "The Last Supper" in Milan Italy.  He interviewed hundreds of models to get just the right ones to use for each disciple choosing the one to portray Christ first.  Six years later he looked for someone to be the model for Judas and found a convicted murderer in Rome who fit the part.  When he finished the painting the man revealed that he was the same person Leonardo has used years earlier to be the model for Christ but had degenerated because of his sin and crime.  ,0
l/laurenpingel.htm,Pray for 3-year-old Lauren Renee Pingel in Amarillo Texas,Little Lauren Renee Pingel was in a car accident in Amarillo Texas and despite being strapped in a car seat was severely injured.  Her grandmother has issued an email request for prayer.  ,1
l/lawnchairlarry.htm,Lawnchair Larry the man who soared to 16000 Feet attached to weather balloons,The eRumor is mostly circulated with pictures of Larry in his high-flying chair and what appears to be a newspaper article: ,1
