p/paigelane.htm,Paige Lane a 5-year old who is very sick wants your greeting cards, Thestory that is circulated says that 5 year old PaigeLane is seriously ill and wants as many greeting cards to be sent to her aspossible.   ,0
p/palin-banned-books.htm,Wasilla Mayor Sarah Palin Banned Books,Wasilla  mayor Sarah Palin tried to ban books from the library. Palin asked the library how she might go about banning books because some had inappropriate language in them—shocking the librarian Mary Ellen Baker. ,0
p/palin-bikini.htm,Sarah Palin NRA Poster Girl?,Photo of Republican VP candidate Sarah Palin in an American flag styled bikini posing by a pool holding a rifle. ,0
p/Palin-bush-pilot.htm,Alaskan Bush Pilot Views on Sarah Palin,The  personal comments of a life time Alaskan  bush pilot named Butch King who is extremely proud of Governor Sarah Palin calling her a "straight shooting hard charging get it done gal.". ,1
p/palin-kilkenny.htm,Who Is Sarah Palin? by Anne Kilkenny,An email by  a woman named  Anne Kilkenny describing her views and opinions of GOP Vice Presidential Candidate Sarah Palin.   ,1
p/palin-national-guard.htm,Sarah Palin  National Guard Commander,The eRumor highlights Alaska Governor Sarah Palin's National Guard duties saying that she is briefed on highly classified issues Homeland Security and counterterrorism.   It also says that she is the commander of the Alaska National Guard and the commander in chief of the Alaskan State Defense Force. The eRumor highlights Alaska Governor Sarah Palin's National Guard duties saying that she is briefed on highly classified issues Homeland Security and counterterrorism.   It also says that she is the c ommander of the Alaska National Guard and the  commander in chief of the Alaskan State Defense Force. ,1
p/palin-wolves.htm,Sarah Palin's Controversy about Wolves,eRumor with attached video from the Defenders of Wildlife Action Fund claiming that Alaska Governor Sarah Palin promotes hunting from aircraft of Wolves and Bears.  The Defenders of Wildlife Action Fund website claims that Governor Palin used a loophole in the  Federal Airborne Hunting Act to  " allow private wolf killers to shoot down wolves using aircraft."   The eRumor terms it as "shameful." The eRumor terms it as "shameful." ,1
p/palmbeachzoon.htm,Vote for the Palm Beach Zoo in Microsoft Contest!,You are asked to go to a Microsoft website and vote for the Palm Beach Zoo in a contest that could win a cash prize. ,1
p/pandg-gaymarriage.htm,Procter & Gamble supports a Gay Rights Proposal as Well as GayMarriage,The eRumor encourages a boycott of Procter & Gamble for the company's support of a controversial ballot issue in Cincinnati that is regarded as a pro-homosexual measure. ,1
p/pandg-gays.htm,Gay ad from Procter & Gamble?,The eRumor is from the American Family Association and says that Procter & Gamble has published a print ad that shows two men in bed after an apparent sexual encounter. The email encourages a boycott of Procter & Gamble for the ad and for other statements in support of homosexuality. Another email campaign urged protest against Procter & Gamble for advertising on the "Will and Grace" television show as well as "Queer Eye for the Straight Guy.". ,1
p/pantyraids.htm,New CD-ROM computer game features panty raids, The email says that Simon and Schuster has announced a new CD-ROM computer game where "...to win the game boys must strip supermodels down to their underwear then provide photographs of them to aliens who wore out their one lingerie catalog - or else the aliens hormone driven anger will destroy the earth."  ,1
p/parachute.htm,Who packs your parachute?, This claims to be the story of Navy Pilot Charles Plum who was shot down in Vietnam and spent six years as a prisoner of war. It describes a chance encounter with another Vietnam vet who recognized Plum. Plum asked the man how he knew who he was and the man replied that he had been the one who packed the parachute that had saved Plum's life. Plum got to thank him and comment on the fact that if the parachute packer had not done his job right Plum would not be alive. After that Plum couldn't get the man out of his mind and used the story as an inspirational challenge about "who packs the parachutes in your life?" Who do we have who provide some of what we need each day?  ,1
p/partialeject.htm,Partial ejection from a Navy Jet,The remarkable story of bombardier/navigator Lt. Keith Gallagher whose ejection seat accidentally deployed during flight.  He was partially ejected pushed through the canopy and became stuck with the upper half of his body exposed to the rushing air outside of the plane.  The pilot managed to slow down the A-6 jet and land on the aircraft carrier from which the flight originated and it was a miracle that Gallagher survived.  ,1
p/passion-middleeast.htm,The impact of the film The Passion in the Middle East,An email said to be from a Christian worker in Qatar in the Middle East and describes the impact of Mel Gibson's film The Passion. ,1
p/passion-reviews.htm,Paul Harvey and David Limbaugh review "The Passion",This eRumor includes two separate eRumors that have circulated individually. One is comments by Paul Harvey regarding Mel Gibson's film "The Passion." The other is comments about the film by attorney and conservative columnist David Limbaugh. ,1
p/Pastor-Dave-San-Diego-Permit.htm,San Diego County Officials told pastor that he can not hold a Bible study in his home without a permit ,A forwarded email with a story about a San Diego man and his wife who host a Bible study that meets at their Southern California residence.  The story says that they were visited by a San Diego County official on Good Friday and were told to stop holding "religious assemblies" until they obtained a major use permit. ,1
p/patriots.htm,The hardship of the signers of The Declaration Of Independence,This email goes through a list of some of the signers of the Declaration of Independence that led to the formation of the United States more than 200 years ago.  It says that the signers lived lives of hardship personal loss and poverty and that five of them were captured by the British tortured and died.  The entire email is duplicated at the bottom of this page.    ,1
p/paulharveycommentary.htm,"If I Were the Devil" by Paul Harvey,A piece of prose about the state of man the world and the United States said to have been written by Paul Harvey.  ,1
p/paypal-customer-review-scam.htm,PayPal Customer Review Team Warning of Unusual Charges,This is an email allegedly sent from PayPal that says they have detected unusual charges on the credit card that is linked to the PayPal account.  The email warns that the account has been limited and comes with a compressed file attached for the reader to open and confirm the account.  ,0
p/paypal.htm,PayPal wants you to update your financial information,There are a couple of versions of this eRumor and some versions have them combined. One says it's from PayPal the online payment system and that your account will be closed in 5 days unless you verify your account information with them. The other says that because of routine security precautions you are to go to PayPal to verify your account information and it includes a link that is allegedly to PayPal. ,0
p/paypalchain.htm,Make big bucks in a PayPal Scheme,This is a long email that suggests a technique for using the PayPal online payment service for making thousands of dollars in an easy and inexpensive way. ,0
p/paypalsettle.htm,Email about a PayPal Class Action Settlement,The eRumor says that there is a class action settlement between PayPal and certain people who opened PayPal accounts between October 1999 and January 2004. ,1
p/pbs-palin-poll.htm,PBS Palin Poll,An email pleading that readers to participate in an online PBS poll asking if viewers believe that Governor Sarah Palin qualified for the office of Vice President of the United Sates. ,1
p/peaceagency.htm,Proposal to create a department of peace, It is alleged that Congressman Dennis Kucinich of Ohio has introduced a bill in congress to create a new cabinet level agency called "The Department of Peace." ,1
p/peanut-butter.htm,FDA Warning About Certain Jars of Peter Pan Peanut Butter,The eRumor is a warning not to eat jars of Peter Pan peanut butter with the product code "2111" because of Salmonella contamination. ,1
p/pearl-harbor-photos.htm,Old Pictures From a Brownie Camera of the Attack on Pearl Harbor in 1941,A collection of stunning pictures of the Japanese Attack on the United States at Pearl Harbor Hawaii on December 7 1941.  The eRumor says they were found in an old Brownie camera stored in a footlocker and that they were taken by a sailor who was aboard the USS Quapaw. ,0
p/pell-grants.htm,Pell Grants for foreign students,The originator complains that foreign adult students are receiving federal financial aid for schooling including outright grants from the Pell Grant program.  The writer also refers to two other programs "WAIT" and "Caribe" that provide assistance to students. ,1
p/pelosi-plane.htm,Pelosi On A Plane,A forwarded email that complains about Speaker of the House Nancy Pelosi using a "Big Fat Jet" that has the capacity for 200 passengers and wastes fuel when she travels alone from her home state of California to Washington DC.  ,1
p/pelosi.htm,Nancy Pelosi on Taxing the Rich,Said to be an interview with U.S. Representative Nancy Pelosi.  It first circulated before she was elected Speaker of the House of Representatives and among other things says that she wants to enact a 100% tax o n " windfall profits and income created by the Bush administration."  ,0
p/pennybrown.htm,Help find Penny Brown, An appeal from a mother to help locate her missing 9 year old daughter Penny Brown. ,0
p/pentagon-gay-unit.htm,Openly Gay Military Unit Created by the Pentagon,A forwarded email that appears to be a press release that says that the Pentagon has created an openly gay military unit in response to President Obama's directive to end the "Don't Ask Don't Tell" policy.  The press release says that the Pentagon plans to call the unit "The 69th Fighting  Sodomites" and include changes to uniforms and dorm equipment. ,0
p/pentagoncrash.htm,The Pentagon was not struck by a hijacked jet on September 11,The allegation  is that the destruction at the Pentagon on September 11 was not the result of being hit by a hijacked American Airlines 757 but some other cause.  The theories range from the building being hit by a remote-control U.S. fighter jet to being damaged by a truck bomb.   ,0
p/pepsi.htm,Pepsi decided to remove the words "Under God" from a patriotic soft drink can,You are told that Pepsi removed the words "under God" from a patriotic can that included the Pledge of Allegiance..  You are also urged to tell your pastor and your church about it so a boycott of Pepsi can be conducted. ,0
p/perfume.htm,Perfume peddlers using ether to knock people out and rob them,The author says he or she was approached in a public place such as a mall or on the street and offered the chance to sample some perfume fragrances.  The author declined then later learned that robbers are using that method to disable people with a whiff of ether then robbing them while they are unconscious.  ,0
p/Perseid-Meteor-Shower.htm,Rare Meteor Shower Expected to Delight Sky Watchers,Messages of a rare meteor shower expected between the 12th and 13th of August 2012 are circulating the Internet.   Some rumors say that this is a night spectacular that only comes once every 1000 years.  ,1
p/PETA-Biker-Protester.htm,How Bikers Handle PETA Protesters,This is an account with photo of what happened to a member of People for the Ethical Treatment of Animals (PETA) after protesting motorcycle enthusiasts for wearing leather.   ,0
p/peterjennings.htm,Comment about Bush after 9/11 by Peter Jennings,On September 11 the day of the "Attack on America" by terrorists Peter Jennings allegedly said that President Bush should "quit hiding behind the Secret Service come out and face the nation and explain the 'President's failure' to protect the country." ,0
p/petition-2493.htm,Petition to Stop the Removal of Religious Services and Teachers From Airwaves ,A forwarded email warning readers of an organization that is petitioning the Federal Communications Commission (FCC) to remove religious teachers and pastors from the airwaves.  The email goes on to urge readers to sign another petition to keep the broadcasters on the air. ,0
p/petroexpress.htm,Boycott Petro Express because it's owned by Hugo Chavez,A forwarded email that warns not to buy gas from Petro Express because it's just another name for Citgo the oil company owned by Hugo Chavez the controversial anti-American president of Venezuela.  ,0
p/petshark.htm,The fisherman who befriended a great white shark,A series of pictures sometimes in a PowerPoint presentation of close encounters between a man and a great white shark.  The eRumor says its the story of Australian fisherman Arnold Pointer who once freed a great white shark from a fishing net and the shark has followed him around ever since.   ,0
p/phenylpropanolamine.htm,Popular substance in cold medications pulled from the shelves, There are several different versions of emails warning against taking medications that contain phenylpropanolamine which is popular in cold and decongestant products as well as some weight loss products.    Some of the emails list the over-the-counter products that contain phenylpropanolamine.  It also urges you to call the product manufacturers to get a refund. ,1
p/phishing.htm,Scammers trying to get your financial info,Various emails telephone calls or letters claiming to be from financial institutions retailers or websites and saying that they need you to verify your personal financial information.  Some of them say your credit card may have been used in a fraudulent transaction that they are calling to unravel the details.  Some claim that you must periodically verify your information in order to keep using their services.  ,1
p/photo-pope-virgin.htm,Photo of Pope John Paul II and Virgin Mary,A recently released picture of Pope John Paul II being embraced by the Virgin Mary supposedly taken at the time of his attack on May 13 1981.  The picture is said to have been taken by one of his body guards.  Some versions of this eRumor include a prayer and request to forward this to all your friends to encourage prayer in the world. ,0
p/photocopiers.htm,Digital Photocopiers Have Internal Hard Drives That Store Scanned Documents Which Could Place Your Personal Information at Risk,This is a forwarded video of a CBS News report about modern digital photocopiers that warns that personal information could be at risk because the multifunction office machine scans and saves your documents on an internal hard disk drive.   ,1
p/piggyback.htm,The amazing WW II "piggyback" B-17 mid-air collision,The amazing story of a World War II pilot whose B-17 bomber collided in mid-air with another B-17 and became locked to it in piggy-back fashion. The pilot kept control to allow crew members to bail out then he and his co-pilot guided the crippled craft to a crash landing that destroyed both planes but they survived with no major injuries! ,1
p/ping-wounded-warriors.htm,Ping Donates Golf Equipment to Wounded Veterans,This is a forwarded story of a man who played a round of golf with three strangers one of whom was a recently medically discharged  veteran who was given a free set of golf clubs from Ping as a gift for his service.  ,1
p/pink-dolphins.htm,Rare pink dolphin sighted in Louisiana,A forwarded email with pictures of what the message says is a rare pink dolphin. ,1
p/pitman.htm,"I'm Sorry" from Lt. Gen. Chuck Pitman,A commentary said to be from Marine Lieutenant. General Chuck Pitman.  It is a sequence of several "I'm sorrys" centered on terrorists and terrorism. ,0
p/pleamail-friend-abroad.htm,Plea for Help From a Friend Abroad Who Lost A Wallet,This is an urgent request for funds from a friend or a loved one that says they have lost their wallet and valuables while travelling in a foreign country. ,0
p/pledge.htm,A U.S. Federal Appeals Court has ruled the Pledge of Allegianceunconstitutional ,The eRumor says that the 9th U.S. Circuit Court of Appeals has decided that because the U.S. Pledge of Allegiance mentions God it is unconstitutional because of the separation of church and state.  Follow-up versions say that the suit that brought the decision is a sham because the atheist who filed it isn't the only one with parental authority over the child who was allegedly injured by the pledge and that the child is a Christian. ,1
p/pluck-yew.htm,The history of the middle finger,A story that allegedly gives the background of how we came to use the middle finger as a vulgar insult along with the alleged origin of the "F-word" (we're a family friendly site!) ,0
p/plug-in-air-fresheners.htm,House destroyed by plug-in air fresheners,The email tells the story of a house that burned to the ground and the cause was found to be a Glad Plug-in air freshener. The fire investigator is quoted as saying he's seen more home fires from plug-in type air fresheners than anything else. ,0
p/poinsettias.htm,Poinsettia plants are poison to children and pets, It's common around Christmas time for people to warn one another about the alleged toxicity of poinsettias. ,0
p/poisonperfume.htm,Poisonous perfume arriving in homes by mail, The eRumor claims that seven woman have died from smelling free perfume samples that came to them in the mail.  It also says that the government thinks it may be a terrorist act but doesn't want to alarm people so is not talking about it. ,0
p/police-beheadings.htm,Beheadings of deputies in San Diego County?,The forwarded email says there is a media cover-up of the decapitation of three Sheriff's deputies in San Diego County California.  The facts came to light during testimony at a Congressional hearing on Border Vulnerability. ,0
p/poptabs.htm,Collect Pop tabs from soda cans for charity, There are various eRumors about fund-raising projects that involve collecting and recycling pop-tabs from soft drink cans. ,1
p/pornspam.htm,Child porn credit card charge?,An email seems to be a confirmation from a child porn website of the use of your credit card for purchasing a one month subscription for $149.95. ,0
p/post-american-world.htm,Barack Obama Reading Post-American World,An eRumor titled "What's Obama Reading?" with a photo of Barack Obama holding the book Post-American World by Fareed Zakaria.   The eRumor  implies that Obama  is a Muslim that he is the most liberal nominee to run in history and that this book predicts the end of the United States.  ,1
p/postoffice.htm,Congress is going to tax email messages, Awidely distributed email warns that legislation has been introduced in congressto add a surcharge to email.  Congressional "Bill602P" would add a 5 cents per email tax in order to make up for millions ofdollars being lost by the Postal Service because of people using email tocorrespond instead of letters.  The email makes reference to a recentpublicity campaign by the Postal Service called "There is Nothing Like aLetter" and includes a quote from Congressman Tony Schnell.  Iturges that Internet users contact their representatives in congress to opposethe bill.  ,0
p/potency drink.htm,Customer finds a penis inside the bottle of a fruit drink, This is said to be an article from the Denver Post newspaper. It tells the story of a Colorado man who discovered what appeared to be a penis in a 20-ounce bottle of "Ora Potency Fruit Punch."  Forty-one year old Juan Sanchez-Marchez says he didn't discover the penis until he was about half way finished with the drink.  The "King Sooper" store in Commerce City Colorado where the drink was purchased has pulled all remaining bottles of the product from its shelves.  The police are looking into it although they say that so far they believe Sancez-Marchez.   ,0
p/pottedcactus.htm,The X-rated school cactus project,It is said that some elementary students were doing a potted plant project.  They painted and fired pots that looked like clowns and planted cactus in them.  The result however was that the cactus ended up looking like male genitalia belonging to the clown. ,0
p/pottytruck.htm,Plumbing truck with potty scene on the side,There's no text with this eRumor just a picture that says it all. The picture is of a truck from a plumbing and electrical service company. On the driver's door there is a scene of a torso sitting on a toilet. It is situated such that it looks like the upper part of the body is that of the driver. ,1
p/pow-idaho.htm,The POW confronts anti-war protestors in Moscow Idaho, This is a long story (it appears below) about a macho confrontation between a Vietnam era American POW and anti-war demonstrators in the university town of Moscow Idaho.  The protestors were against the U.S. military action in Afghanistan after the terrorist attacks on the U.S. ,0
p/powell-empires.htm,Colin Powell-All We Want is Land to Bury our Dead,The story is that U.S. Secretary of State Colin Powell was speaking in England.  The Archbishop or Canterbury asked whether plans for a war in Iraq was really an example of "empire building" by President George Bush.  Powell answered that the U.S. has sent many young men and women to fight in foreign lands but has never asked for any more land than is enough in which to bury those who did not return. ,1
p/poweremailtracker.htm,You'll get money and Outback certificates for forwarding an email, The email says that "RH Power Inc." has rented an "email tracker" and is going to send money to every person who forwards the email to others.  ,0
p/presidentialiq.htm,Comparison of presidential IQ's,     This email claims that a think tank in Pennsylvania determined the IQ's of American presidents from Franklin D. Roosevelt to George W. Bush rating bush as the lowest and Bill Clinton as the highest. This email claims that a think tank in Pennsylvania determined the IQ's of American presidents from Franklin D. Roosevelt to George W. Bush rating bush as the lowest and Bill Clinton as the highest. ,0
p/presidentialprayerteam.htm,Presidential Prayer Team organizing prayer for the president,     This report says that www.presidentialprayerteam.org is trying to get 2.8 million people to agree to pray regularly for the president. ,1
p/pritchett-obama-youscareme.htm,"Obama You No Longer Scare Me You Terrify Me" by Lou Pritchett,A forwarded email with an open letter to President Barack Obama from author Lou Pritchett.  In it Pritchett lists many of the unanswered questions about the President's background which raises concerns.  ,1
p/procterandgamble.htm,Executive of Procter & Gamble is a Satanist, Thisemail says that a top executive from Procter & Gamble was on a television talkshow such as Sally Jesse Raphael Phil Donahue or Jenny Jones and said thathe's a Satan worshiper.  He says that the profits from P & G go toSatanism and "there aren't enough Christians to stop him."  Healso goes on to say that the Procter & Gamble logo is that of a wizard and isa part of the influence of Satanism on the company.  ,0
p/propane-tanks.htm,Warnings about propane tanks used for making meth,An alert from a police officer in Oklahoma about a danger involving recycled propane tanks.  She says that people are stealing propane tanks from retailers and using them to transport anhydrous ammonia a substance used in making illegal meth.  They may then exchange them back to the retailers which consumers need to be aware of because the anhydrous ammonia is corrosive and may render the tank dangerous for future use.  She recommends that if you get a tank at a refill station that has blue or green residue around the valve don't use it. ,1
p/pumping-gas.htm,Tips on pumping gas from a pipeline employee,A list of tips about how to pump gas most efficiently so that you can save fuel costs.  Tips such as getting gas in the morning and filling the tank when it is still half full.  The writer of the email says he's an employee of the Kinder Morgan Pipeline in San Jose.  ,0
p/pumpkins.htm,Beware of toxic pumpkins with deadly vapors,Allegedly from a Ph.D.at the University of Vermont this warning says that the 2006 pumpkin crop in New England in the U.S. is infected with a virus that results in toxic fumes coming from the pumpkin when it is cut open.  The email claims that a woman in Vermont is in a coma because of having passed out and hit her head after being overcome by pumpkin fumes.  The virus is allegedly called "squash mosaic Como virus." ,0
p/puppy.htm,Puppy death recorded in video in Iraq,The eRumor includes links to a video of a U.S. Marine holding a small puppy then apparently throwing it into a ravine to its death.  The email includes a sample letter of complaint and addresses of Marine officials to whom it can be sent. ,1
p/purell.htm,Severe burns on a man's hands from a hand sanitizer fire?,The eRumor appears to be from Chevron and warns about the possibility that hand sanitizer gel could ignite on your hands.  It shows pictures of a man who allegedly experienced that during a cigarette break.  The eRumor shows a picture of Purell brand hand sanitizer and warns to not get your hands near a flame before fully rubbing the gel into your skin. ,0
